[
    {
        "dataset": "ds003",
        "participant": "01",
        "modality": "anat",
        "filename": "sub-01_inplaneT2.nii.gz",
        "filename_keys": [
            "inplaneT2"
        ]
    },
    {
        "dataset": "ds003",
        "participant": "01",
        "modality": "anat",
        "filename": "sub-01_T1w.nii.gz",
        "filename_keys": [
            "T1w"
        ]
    },
    {
        "dataset": "ds003",
        "participant": "01",
        "modality": "func",
        "filename": "sub-01_task-rhymejudgment_bold.nii.gz",
        "filename_keys": [
            "task-rhymejudgment",
            "bold"
        ]
    },
    {
        "dataset": "ds003",
        "participant": "02",
        "modality": "anat",
        "filename": "sub-02_inplaneT2.nii.gz",
        "filename_keys": [
            "inplaneT2"
        ]
    },
    {
        "dataset": "ds003",
        "participant": "02",
        "modality": "anat",
        "filename": "sub-02_T1w.nii.gz",
        "filename_keys": [
            "T1w"
        ]
    },
    {
        "dataset": "ds003",
        "participant": "02",
        "modality": "func",
        "filename": "sub-02_task-rhymejudgment_bold.nii.gz",
        "filename_keys": [
            "task-rhymejudgment",
            "bold"
        ]
    },
    {
        "dataset": "ds003",
        "participant": "03",
        "modality": "anat",
        "filename": "sub-03_inplaneT2.nii.gz",
        "filename_keys": [
            "inplaneT2"
        ]
    },
    {
        "dataset": "ds003",
        "participant": "03",
        "modality": "anat",
        "filename": "sub-03_T1w.nii.gz",
        "filename_keys": [
            "T1w"
        ]
    },
    {
        "dataset": "ds003",
        "participant": "03",
        "modality": "func",
        "filename": "sub-03_task-rhymejudgment_bold.nii.gz",
        "filename_keys": [
            "task-rhymejudgment",
            "bold"
        ]
    },
    {
        "dataset": "ds003",
        "participant": "04",
        "modality": "anat",
        "filename": "sub-04_inplaneT2.nii.gz",
        "filename_keys": [
            "inplaneT2"
        ]
    },
    {
        "dataset": "ds003",
        "participant": "04",
        "modality": "anat",
        "filename": "sub-04_T1w.nii.gz",
        "filename_keys": [
            "T1w"
        ]
    },
    {
        "dataset": "ds003",
        "participant": "04",
        "modality": "func",
        "filename": "sub-04_task-rhymejudgment_bold.nii.gz",
        "filename_keys": [
            "task-rhymejudgment",
            "bold"
        ]
    },
    {
        "dataset": "ds003",
        "participant": "05",
        "modality": "anat",
        "filename": "sub-05_inplaneT2.nii.gz",
        "filename_keys": [
            "inplaneT2"
        ]
    },
    {
        "dataset": "ds003",
        "participant": "05",
        "modality": "anat",
        "filename": "sub-05_T1w.nii.gz",
        "filename_keys": [
            "T1w"
        ]
    },
    {
        "dataset": "ds003",
        "participant": "05",
        "modality": "func",
        "filename": "sub-05_task-rhymejudgment_bold.nii.gz",
        "filename_keys": [
            "task-rhymejudgment",
            "bold"
        ]
    },
    {
        "dataset": "ds003",
        "participant": "06",
        "modality": "anat",
        "filename": "sub-06_inplaneT2.nii.gz",
        "filename_keys": [
            "inplaneT2"
        ]
    },
    {
        "dataset": "ds003",
        "participant": "06",
        "modality": "anat",
        "filename": "sub-06_T1w.nii.gz",
        "filename_keys": [
            "T1w"
        ]
    },
    {
        "dataset": "ds003",
        "participant": "06",
        "modality": "func",
        "filename": "sub-06_task-rhymejudgment_bold.nii.gz",
        "filename_keys": [
            "task-rhymejudgment",
            "bold"
        ]
    },
    {
        "dataset": "ds003",
        "participant": "07",
        "modality": "anat",
        "filename": "sub-07_inplaneT2.nii.gz",
        "filename_keys": [
            "inplaneT2"
        ]
    },
    {
        "dataset": "ds003",
        "participant": "07",
        "modality": "anat",
        "filename": "sub-07_T1w.nii.gz",
        "filename_keys": [
            "T1w"
        ]
    },
    {
        "dataset": "ds003",
        "participant": "07",
        "modality": "func",
        "filename": "sub-07_task-rhymejudgment_bold.nii.gz",
        "filename_keys": [
            "task-rhymejudgment",
            "bold"
        ]
    },
    {
        "dataset": "ds003",
        "participant": "08",
        "modality": "anat",
        "filename": "sub-08_inplaneT2.nii.gz",
        "filename_keys": [
            "inplaneT2"
        ]
    },
    {
        "dataset": "ds003",
        "participant": "08",
        "modality": "anat",
        "filename": "sub-08_T1w.nii.gz",
        "filename_keys": [
            "T1w"
        ]
    },
    {
        "dataset": "ds003",
        "participant": "08",
        "modality": "func",
        "filename": "sub-08_task-rhymejudgment_bold.nii.gz",
        "filename_keys": [
            "task-rhymejudgment",
            "bold"
        ]
    },
    {
        "dataset": "ds003",
        "participant": "09",
        "modality": "anat",
        "filename": "sub-09_inplaneT2.nii.gz",
        "filename_keys": [
            "inplaneT2"
        ]
    },
    {
        "dataset": "ds003",
        "participant": "09",
        "modality": "anat",
        "filename": "sub-09_T1w.nii.gz",
        "filename_keys": [
            "T1w"
        ]
    },
    {
        "dataset": "ds003",
        "participant": "09",
        "modality": "func",
        "filename": "sub-09_task-rhymejudgment_bold.nii.gz",
        "filename_keys": [
            "task-rhymejudgment",
            "bold"
        ]
    },
    {
        "dataset": "ds003",
        "participant": "10",
        "modality": "anat",
        "filename": "sub-10_inplaneT2.nii.gz",
        "filename_keys": [
            "inplaneT2"
        ]
    },
    {
        "dataset": "ds003",
        "participant": "10",
        "modality": "anat",
        "filename": "sub-10_T1w.nii.gz",
        "filename_keys": [
            "T1w"
        ]
    },
    {
        "dataset": "ds003",
        "participant": "10",
        "modality": "func",
        "filename": "sub-10_task-rhymejudgment_bold.nii.gz",
        "filename_keys": [
            "task-rhymejudgment",
            "bold"
        ]
    },
    {
        "dataset": "ds003",
        "participant": "11",
        "modality": "anat",
        "filename": "sub-11_inplaneT2.nii.gz",
        "filename_keys": [
            "inplaneT2"
        ]
    },
    {
        "dataset": "ds003",
        "participant": "11",
        "modality": "anat",
        "filename": "sub-11_T1w.nii.gz",
        "filename_keys": [
            "T1w"
        ]
    },
    {
        "dataset": "ds003",
        "participant": "11",
        "modality": "func",
        "filename": "sub-11_task-rhymejudgment_bold.nii.gz",
        "filename_keys": [
            "task-rhymejudgment",
            "bold"
        ]
    },
    {
        "dataset": "ds003",
        "participant": "12",
        "modality": "anat",
        "filename": "sub-12_inplaneT2.nii.gz",
        "filename_keys": [
            "inplaneT2"
        ]
    },
    {
        "dataset": "ds003",
        "participant": "12",
        "modality": "anat",
        "filename": "sub-12_T1w.nii.gz",
        "filename_keys": [
            "T1w"
        ]
    },
    {
        "dataset": "ds003",
        "participant": "12",
        "modality": "func",
        "filename": "sub-12_task-rhymejudgment_bold.nii.gz",
        "filename_keys": [
            "task-rhymejudgment",
            "bold"
        ]
    },
    {
        "dataset": "ds003",
        "participant": "13",
        "modality": "anat",
        "filename": "sub-13_inplaneT2.nii.gz",
        "filename_keys": [
            "inplaneT2"
        ]
    },
    {
        "dataset": "ds003",
        "participant": "13",
        "modality": "anat",
        "filename": "sub-13_T1w.nii.gz",
        "filename_keys": [
            "T1w"
        ]
    },
    {
        "dataset": "ds003",
        "participant": "13",
        "modality": "func",
        "filename": "sub-13_task-rhymejudgment_bold.nii.gz",
        "filename_keys": [
            "task-rhymejudgment",
            "bold"
        ]
    }
]